[
  {
    "source_file_id": "source_national_puf_household",
    "logical_dataset": "household",
    "label": "2023 AHS National PUF household relation",
    "access_level": "PUF",
    "grain": "HOUSING_UNIT",
    "relationship_keys": [
      "CONTROL"
    ],
    "row_identity_columns": [
      "CONTROL"
    ],
    "declared_primary_key": [
      "CONTROL"
    ],
    "notes": [
      "One housing-unit record per CONTROL is expected for the governed household relation."
    ]
  },
  {
    "source_file_id": "source_puf_mortgage",
    "logical_dataset": "mortgage",
    "label": "2023 AHS National PUF mortgage relation",
    "access_level": "PUF",
    "grain": "MORTGAGE",
    "relationship_keys": [
      "CONTROL"
    ],
    "row_identity_columns": [
      "CONTROL",
      "MORTLINE"
    ],
    "declared_primary_key": [
      "CONTROL",
      "MORTLINE"
    ],
    "notes": [
      "Mortgage rows are one-to-many from household and must be preaggregated before household weighting."
    ]
  },
  {
    "source_file_id": "source_puf_projects",
    "logical_dataset": "projects",
    "label": "2023 AHS National PUF project relation",
    "access_level": "PUF",
    "grain": "PROJECT",
    "relationship_keys": [
      "CONTROL"
    ],
    "row_identity_columns": [],
    "declared_primary_key": null,
    "notes": [
      "The public project relation is related to household through CONTROL.",
      "No PROJECTNO column is required or assumed.",
      "A row-level project identifier may be certified later if verified against the physical release."
    ]
  },
  {
    "source_file_id": "source_iuf_projects",
    "logical_dataset": "projects_iuf",
    "label": "AHS project relation in restricted-use context",
    "access_level": "IUF",
    "grain": "PROJECT",
    "relationship_keys": [
      "CONTROL"
    ],
    "row_identity_columns": [],
    "declared_primary_key": null,
    "notes": [
      "Physical row identity remains unresolved and is not used by the PUF runtime."
    ]
  }
]
